{
  "$schema": "https://json-schema.org/draft/2020-12/schema",
  "$id": "https://appsec-advisor/schemas/fragments/critical-attack-tree.schema.json",
  "title": "Critical Findings by Root Cause fragment",
  "description": "Generated from threat-model.yaml for the unnumbered `## Critical Findings by Root Cause` section between the Management Summary and Section 1. The Mermaid graph links each `risk == Critical` finding (`leaf`) to the weakness records that explain it (`rootcause`) or to one `unassigned` node, and those to the `goal`. `fixes[]` lists each root cause's structural fix and the Critical findings it closes.",
  "type": "object",
  "required": ["mermaid"],
  "additionalProperties": false,
  "properties": {
    "intro": {
      "type": "string",
      "minLength": 40,
      "maxLength": 600,
      "description": "DEPRECATED (2026-05-30): no longer rendered — the section opens with a fixed one-line explanation. Retained as optional only so pre-2026-05-30 fragments still validate; new fragments should omit it."
    },
    "root_goal": {
      "type": "string",
      "minLength": 5,
      "maxLength": 120,
      "description": "Short business-impact statement that names the attacker's terminal objective (e.g. 'Full admin takeover', 'Customer PII exfiltration'). Rendered as the root node label."
    },
    "mermaid": {
      "type": "object",
      "required": ["orientation", "nodes", "edges"],
      "additionalProperties": false,
      "properties": {
        "orientation": {
          "type": "string",
          "enum": ["TD", "TB"],
          "description": "Authored value is NOT used for layout — the renderer normalizes the unified tree to `graph LR` (sibling leaves stack vertically, so one diagram stays readable at any fan-out). Retained for backward compatibility; author `TD`."
        },
        "nodes": {
          "type": "array",
          "minItems": 3,
          "maxItems": 30,
          "items": {
            "type": "object",
            "required": ["id", "label", "class"],
            "additionalProperties": false,
            "properties": {
              "id":    { "type": "string", "pattern": "^[A-Z][A-Z0-9_]*$" },
              "label": { "type": "string", "minLength": 1, "maxLength": 120 },
              "class": {
                "type": "string",
                "enum": ["goal", "rootcause", "unassigned", "and_node", "or_node", "leaf", "attacker", "crit", "high", "medium", "low", "impact", "system"],
                "description": "`goal` (root), `rootcause` (a weakness record), `unassigned` (Criticals without a linked weakness), `leaf` (a Critical finding). `and_node` / `or_node` and the chain classes remain valid for fragments written by earlier versions."
              },
              "detail": {
                "type": "string",
                "minLength": 1,
                "maxLength": 80,
                "description": "Optional second line of a leaf, the file name of its first evidence location."
              },
              "finding_ref": {
                "type": "string",
                "pattern": "^[FT]-\\d{3,4}$",
                "description": "Optional F-NNN or T-NNN backlink. Required when `class` is `leaf` so the renderer can emit a deep link into §8 Threat Register."
              }
            }
          }
        },
        "edges": {
          "type": "array",
          "minItems": 2,
          "maxItems": 60,
          "items": {
            "type": "object",
            "required": ["from", "to"],
            "additionalProperties": false,
            "properties": {
              "from":  { "type": "string" },
              "to":    { "type": "string" },
              "label": { "type": "string", "maxLength": 60 },
              "refinement": {
                "type": "string",
                "enum": ["AND", "OR"],
                "description": "DEPRECATED (2026-05-30): the rendered AND/OR edge label is now DERIVED from the destination node's class (`or_node`→OR, `and_node`→AND), which makes a per-edge value contradicting the parent class impossible. This field is no longer read; encode AND/OR via the parent node's `class` instead."
              }
            }
          }
        }
      }
    },
    "critical_count": {
      "type": "integer",
      "minimum": 2,
      "description": "Number of `risk == Critical` findings; larger than the leaf count when the node cap leaves some out of the graph."
    },
    "fixes": {
      "type": "array",
      "maxItems": 30,
      "description": "One entry per `rootcause` node that has a structural recommendation, in node order.",
      "items": {
        "type": "object",
        "required": ["weakness", "recommendation", "findings"],
        "additionalProperties": false,
        "properties": {
          "weakness": { "type": "string", "pattern": "^W-\\d{3,4}$" },
          "recommendation": { "type": "string", "minLength": 1, "maxLength": 400 },
          "findings": {
            "type": "array",
            "minItems": 1,
            "items": { "type": "string", "pattern": "^[FT]-\\d{3,4}$" }
          }
        }
      }
    },
    "key_takeaway": {
      "type": "string",
      "minLength": 60,
      "maxLength": 800,
      "description": "DEPRECATED (2026-05-30): no longer rendered — the Branch table now carries the cross-finding view. Retained as optional only for backward compatibility with pre-2026-05-30 fragments; new fragments should omit it."
    },
    "mitigation_breakpoints": {
      "type": "array",
      "maxItems": 8,
      "description": "DEPRECATED (2026-05-30): no longer rendered — the Branch table's Primary Mitigation column (derived from canonical mitigations[].threat_ids) supersedes it. Retained as optional only for backward compatibility; new fragments should omit it.",
      "items": {
        "type": "object",
        "required": ["mitigation", "breaks"],
        "additionalProperties": false,
        "properties": {
          "mitigation": { "type": "string", "pattern": "^M-\\d{3,4}$" },
          "breaks":     { "type": "string", "minLength": 10, "maxLength": 200 }
        }
      }
    },
    "stages": {
      "type": "array",
      "minItems": 3,
      "maxItems": 12,
      "description": "DEPRECATED (2026-05-30): no longer rendered. The section now shows a one-line findings pointer derived from the tree's leaf nodes (mitigations live in §9, not here). Retained as optional only for backward compatibility with pre-2026-05-30 fragments; new fragments should omit it.",
      "items": {
        "type": "object",
        "required": ["stage", "findings", "mitigations"],
        "additionalProperties": false,
        "properties": {
          "stage":       { "type": "string", "minLength": 5, "maxLength": 80 },
          "findings":    {
            "type": "array",
            "minItems": 1,
            "maxItems": 5,
            "items":     { "type": "string", "pattern": "^[FT]-\\d{3,4}$" }
          },
          "mitigations": {
            "type": "array",
            "minItems": 1,
            "maxItems": 5,
            "items":     { "type": "string", "pattern": "^M-\\d{3,4}$" }
          }
        }
      }
    }
  }
}
