{
  "root_goal": "3 Critical findings",
  "critical_count": 3,
  "mermaid": {
    "orientation": "TD",
    "nodes": [
      {
        "id": "GOAL",
        "label": "3 Critical findings",
        "class": "goal"
      },
      {
        "id": "UNLINKED",
        "label": "No root cause linked",
        "class": "unassigned"
      },
      {
        "id": "T001",
        "label": "T-001 SQL injection in product search",
        "class": "leaf"
      },
      {
        "id": "T002",
        "label": "T-002 SQL injection in login",
        "class": "leaf"
      },
      {
        "id": "T003",
        "label": "T-003 Hardcoded RSA private key",
        "class": "leaf"
      }
    ],
    "edges": [
      {
        "from": "UNLINKED",
        "to": "GOAL"
      },
      {
        "from": "T001",
        "to": "UNLINKED"
      },
      {
        "from": "T002",
        "to": "UNLINKED"
      },
      {
        "from": "T003",
        "to": "UNLINKED"
      }
    ]
  },
  "fixes": []
}
